title,description,servings,total_time_iso,ingredients,steps,tags
Lasagne,Klassische Lasagne mit Bolognese und Béchamelsauce. TM-Hinweis: Bolo und Béchamel jeweils im Mixtopf kochen; Schichten im Ofen.,4 Personen,PT1H0M,12 Lasagneblätter|500 g Rinderhack|1 Zwiebel|2 Knoblauchzehen|1 Karotte|1 Dose Tomaten (400 g)|2 EL Tomatenmark|200 ml Brühe|2 EL Öl|Salz|Pfeffer|Oregano|Béchamel: 50 g Butter|50 g Mehl|500 ml Milch|Muskat|150 g geriebener Käse,"Bolognese: Zwiebel (im TM: Zwiebel/Knoblauch 5 Sek./Stufe 5 zerkleinern, mit Spatel nach unten schieben).|Knoblauch (im TM: Zwiebel/Knoblauch 5 Sek./Stufe 5 zerkleinern, mit Spatel nach unten schieben).|Karotte würfeln (im TM: Zwiebel/Knoblauch 5 Sek./Stufe 5 zerkleinern, mit Spatel nach unten schieben).|in Öl anschwitzen (im TM: mit 1 EL Öl 3–5 Min./120 °C/Linkslauf/Stufe 1 dünsten (Messbecher entfernt)).|Hack anbraten (im TM: mit 1 EL Öl 3–5 Min./120 °C/Linkslauf/Stufe 1 dünsten (Messbecher entfernt); Für Röstaromen Pfanne/Backofen; alternativ TM6 Anbratfunktion nutzen (5 Min.)).|Tomatenmark (im TM: je nach Schritt 10 Sek./Stufe 3 mischen oder 5–10 Min./98 °C/Linkslauf/Stufe 1 garen).|Tomaten (im TM: je nach Schritt 10 Sek./Stufe 3 mischen oder 5–10 Min./98 °C/Linkslauf/Stufe 1 garen).|Brühe (im TM: je nach Schritt 10 Sek./Stufe 3 mischen oder 5–10 Min./98 °C/Linkslauf/Stufe 1 garen).|Gewürze hinzufügen (im TM: je nach Schritt 10 Sek./Stufe 3 mischen oder 5–10 Min./98 °C/Linkslauf/Stufe 1 garen).|20 Min köcheln. (im TM: 10–20 Min./98 °C/Linkslauf/Stufe 1 garen).|Béchamel: Butter schmelzen (im TM: je nach Schritt 10 Sek./Stufe 3 mischen oder 5–10 Min./98 °C/Linkslauf/Stufe 1 garen).|Mehl anschwitzen (im TM: mit 1 EL Öl 3–5 Min./120 °C/Linkslauf/Stufe 1 dünsten (Messbecher entfernt)).|Milch einrühren (im TM: je nach Schritt 10 Sek./Stufe 3 mischen oder 5–10 Min./98 °C/Linkslauf/Stufe 1 garen).|mit Muskat würzen. (im TM: je nach Schritt 10 Sek./Stufe 3 mischen oder 5–10 Min./98 °C/Linkslauf/Stufe 1 garen).|In Auflaufform schichten: Bolo (im TM: je nach Schritt 10 Sek./Stufe 3 mischen oder 5–10 Min./98 °C/Linkslauf/Stufe 1 garen).|Lasagneblätter (im TM: je nach Schritt 10 Sek./Stufe 3 mischen oder 5–10 Min./98 °C/Linkslauf/Stufe 1 garen).|Béchamel (im TM: je nach Schritt 10 Sek./Stufe 3 mischen oder 5–10 Min./98 °C/Linkslauf/Stufe 1 garen).|wiederholen (im TM: je nach Schritt 10 Sek./Stufe 3 mischen oder 5–10 Min./98 °C/Linkslauf/Stufe 1 garen).|mit Käse abschließen. (im TM: je nach Schritt 10 Sek./Stufe 3 mischen oder 5–10 Min./98 °C/Linkslauf/Stufe 1 garen).|Bei 180–200°C ca. 35–40 Minuten backen. (im TM: Hinweis: Backofen extern nutzen; TM für Saucen/Beilagen verwenden).","auflauf,klassiker"
Spitzkohl-Hackfleischpfanne,"Schnelle Pfanne mit Spitzkohl und Hack. TM-Hinweis: Kohl im Mixtopf 4–5 Sek./Stufe 4 zerkleinern, Hack separat anbraten.",4 Personen,PT25M,500 g Rinderhack|1 kleiner Spitzkohl|1 Zwiebel|2 Knoblauchzehen|2 EL Öl|100 ml Brühe|1 TL Paprika edelsüß|Salz|Pfeffer|Petersilie,"Hack in Pfanne krümelig braten. (im TM: Für Röstaromen Pfanne/Backofen; alternativ TM6 Anbratfunktion nutzen (5 Min.)).|Zwiebel und Knoblauch würfeln (im TM: Zwiebel/Knoblauch 5 Sek./Stufe 5 zerkleinern, mit Spatel nach unten schieben).|zugeben (im TM: je nach Schritt 10 Sek./Stufe 3 mischen oder 5–10 Min./98 °C/Linkslauf/Stufe 1 garen).|anschwitzen. (im TM: mit 1 EL Öl 3–5 Min./120 °C/Linkslauf/Stufe 1 dünsten (Messbecher entfernt)).|Spitzkohl in Streifen (im TM: je nach Schritt 10 Sek./Stufe 3 mischen oder 5–10 Min./98 °C/Linkslauf/Stufe 1 garen).|mitbraten. (im TM: Für Röstaromen Pfanne/Backofen; alternativ TM6 Anbratfunktion nutzen (5 Min.)).|Mit Brühe ablöschen (im TM: je nach Schritt 10 Sek./Stufe 3 mischen oder 5–10 Min./98 °C/Linkslauf/Stufe 1 garen).|würzen und 10 Minuten garen. (im TM: 10–20 Min./98 °C/Linkslauf/Stufe 1 garen).|Mit Petersilie servieren. (im TM: je nach Schritt 10 Sek./Stufe 3 mischen oder 5–10 Min./98 °C/Linkslauf/Stufe 1 garen).","pfannengericht,lowcarb"
Omas Möhreneintopf,Klassischer Karotten-Kartoffel-Eintopf. TM-Hinweis: Gemüse 5 Sek./Stufe 5; dann 25 Min./100°C/Rührstufe mit Brühe garen.,4 Personen,PT40M,600 g Möhren|400 g Kartoffeln|1 Stange Lauch|1 Zwiebel|1|2 l Gemüsebrühe|2 EL Butter oder Öl|Salz|Pfeffer|Petersilie,"Gemüse putzen und würfeln. (im TM: Zwiebel/Knoblauch 5 Sek./Stufe 5 zerkleinern, mit Spatel nach unten schieben).|Zwiebel anschwitzen (im TM: Zwiebel/Knoblauch 5 Sek./Stufe 5 zerkleinern, mit Spatel nach unten schieben; mit 1 EL Öl 3–5 Min./120 °C/Linkslauf/Stufe 1 dünsten (Messbecher entfernt)).|restliches Gemüse kurz mitdünsten. (im TM: je nach Schritt 10 Sek./Stufe 3 mischen oder 5–10 Min./98 °C/Linkslauf/Stufe 1 garen).|Mit Brühe aufgießen und 20–25 Minuten köcheln lassen. (im TM: 10–20 Min./98 °C/Linkslauf/Stufe 1 garen).|Mit Salz (im TM: je nach Schritt 10 Sek./Stufe 3 mischen oder 5–10 Min./98 °C/Linkslauf/Stufe 1 garen).|Pfeffer abschmecken (im TM: je nach Schritt 10 Sek./Stufe 3 mischen oder 5–10 Min./98 °C/Linkslauf/Stufe 1 garen).|mit Petersilie bestreuen. (im TM: je nach Schritt 10 Sek./Stufe 3 mischen oder 5–10 Min./98 °C/Linkslauf/Stufe 1 garen).","eintopf,familienklassiker"
Pad Thai,"Reisnudeln mit Ei, Tofu/Huhn, Sprossen, Erdnüssen. TM-Hinweis: Sauce 5 Sek./Stufe 5 mischen; Nudeln separat.",4 Personen,PT30M,300 g Reisnudeln (breit)|300 g Hähnchenbrust oder Tofu|2 Eier|2 Frühlingszwiebeln|2 Knoblauchzehen|100 g Mungobohnensprossen|50 g Erdnüsse|geröstet|2 EL Fischsauce oder Sojasoße|2 EL Tamarindenpaste (oder Limettensaft)|1 EL Zucker|2 EL Öl|Limettenspalten|Chiliflocken|Koriander,"Reisnudeln nach Packung einweichen/kochen. (im TM: 10–20 Min./98 °C/Linkslauf/Stufe 1 garen).|Hähnchen/Tofu würfeln (im TM: Zwiebel/Knoblauch 5 Sek./Stufe 5 zerkleinern, mit Spatel nach unten schieben).|in Öl anbraten (im TM: mit 1 EL Öl 3–5 Min./120 °C/Linkslauf/Stufe 1 dünsten (Messbecher entfernt); Für Röstaromen Pfanne/Backofen; alternativ TM6 Anbratfunktion nutzen (5 Min.)).|herausnehmen. (im TM: je nach Schritt 10 Sek./Stufe 3 mischen oder 5–10 Min./98 °C/Linkslauf/Stufe 1 garen).|Knoblauch und Frühlingszwiebeln anbraten (im TM: Zwiebel/Knoblauch 5 Sek./Stufe 5 zerkleinern, mit Spatel nach unten schieben; mit 1 EL Öl 3–5 Min./120 °C/Linkslauf/Stufe 1 dünsten (Messbecher entfernt); Für Röstaromen Pfanne/Backofen; alternativ TM6 Anbratfunktion nutzen (5 Min.)).|Eier stocken lassen. (im TM: je nach Schritt 10 Sek./Stufe 3 mischen oder 5–10 Min./98 °C/Linkslauf/Stufe 1 garen).|Nudeln (im TM: je nach Schritt 10 Sek./Stufe 3 mischen oder 5–10 Min./98 °C/Linkslauf/Stufe 1 garen).|Sauce (Fischsauce/Soja, Tamarinde/Limette, Zucker) (im TM: je nach Schritt 10 Sek./Stufe 3 mischen oder 5–10 Min./98 °C/Linkslauf/Stufe 1 garen).|Sprossen und Fleisch/Tofu zugeben (im TM: je nach Schritt 10 Sek./Stufe 3 mischen oder 5–10 Min./98 °C/Linkslauf/Stufe 1 garen).|kurz braten. (im TM: Für Röstaromen Pfanne/Backofen; alternativ TM6 Anbratfunktion nutzen (5 Min.)).|Mit Erdnüssen (im TM: je nach Schritt 10 Sek./Stufe 3 mischen oder 5–10 Min./98 °C/Linkslauf/Stufe 1 garen).|Koriander (im TM: je nach Schritt 10 Sek./Stufe 3 mischen oder 5–10 Min./98 °C/Linkslauf/Stufe 1 garen).|Limette servieren. (im TM: je nach Schritt 10 Sek./Stufe 3 mischen oder 5–10 Min./98 °C/Linkslauf/Stufe 1 garen).","asia,pfannengericht"
Kartoffelgulasch,"Deftiger Eintopf mit Kartoffeln, Paprika und Würstchen optional. TM-Hinweis: Zwiebeln/Paprika 5 Sek./Stufe 5, 25–30 Min./100°C garen.",4 Personen,PT45M,800 g Kartoffeln|2 Zwiebeln|1 rote Paprika|1 gelbe Paprika|2 EL Tomatenmark|1 TL Paprika edelsüß|1 l Gemüsebrühe|2 EL Öl|Salz|Pfeffer|4 Wiener Würstchen (optional),"Zwiebeln würfeln und in Öl anschwitzen. (im TM: Zwiebel/Knoblauch 5 Sek./Stufe 5 zerkleinern, mit Spatel nach unten schieben; mit 1 EL Öl 3–5 Min./120 °C/Linkslauf/Stufe 1 dünsten (Messbecher entfernt)).|Paprika in Stücke (im TM: je nach Schritt 10 Sek./Stufe 3 mischen oder 5–10 Min./98 °C/Linkslauf/Stufe 1 garen).|Kartoffeln würfeln (im TM: Zwiebel/Knoblauch 5 Sek./Stufe 5 zerkleinern, mit Spatel nach unten schieben).|kurz mitrösten. (im TM: mit 1 EL Öl 3–5 Min./120 °C/Linkslauf/Stufe 1 dünsten (Messbecher entfernt)).|Tomatenmark und Paprikapulver zugeben (im TM: je nach Schritt 10 Sek./Stufe 3 mischen oder 5–10 Min./98 °C/Linkslauf/Stufe 1 garen).|mit Brühe aufgießen. (im TM: je nach Schritt 10 Sek./Stufe 3 mischen oder 5–10 Min./98 °C/Linkslauf/Stufe 1 garen).|20–25 Minuten köcheln lassen (im TM: 10–20 Min./98 °C/Linkslauf/Stufe 1 garen).|evtl. Würstchen in Scheiben zugeben. (im TM: je nach Schritt 10 Sek./Stufe 3 mischen oder 5–10 Min./98 °C/Linkslauf/Stufe 1 garen).|Mit Salz und Pfeffer abschmecken. (im TM: je nach Schritt 10 Sek./Stufe 3 mischen oder 5–10 Min./98 °C/Linkslauf/Stufe 1 garen).","eintopf,budget"
Frikadellen mit Kartoffelbrei und Soße,"Klassiker: saftige Buletten, cremiges Püree, schnelle Bratensoße. TM-Hinweis: Püree im Mixtopf (Kartoffeln garen, dann Milch/Butter untermixen).",4 Personen,PT50M,500 g gemischtes Hackfleisch|1 altbackenes Brötchen (eingeweicht) oder 2 EL Semmelbrösel|1 Ei|1 Zwiebel|1 TL Senf|Salz|Pfeffer|Paprika|Öl zum Braten|Kartoffelbrei: 1 kg Kartoffeln|200 ml Milch|40 g Butter|Salz|Muskat|Soße: 250 ml Bratenfond oder Brühe|1 EL Mehl|1 EL Butter,"Hack mit eingeweichtem Brötchen/Bröseln (im TM: je nach Schritt 10 Sek./Stufe 3 mischen oder 5–10 Min./98 °C/Linkslauf/Stufe 1 garen).|Ei (im TM: je nach Schritt 10 Sek./Stufe 3 mischen oder 5–10 Min./98 °C/Linkslauf/Stufe 1 garen).|gehackter Zwiebel (im TM: Zwiebel/Knoblauch 5 Sek./Stufe 5 zerkleinern, mit Spatel nach unten schieben).|Senf und Gewürzen mischen (im TM: je nach Schritt 10 Sek./Stufe 3 mischen oder 5–10 Min./98 °C/Linkslauf/Stufe 1 garen).|Frikadellen formen. (im TM: je nach Schritt 10 Sek./Stufe 3 mischen oder 5–10 Min./98 °C/Linkslauf/Stufe 1 garen).|In Öl beidseitig braten. (im TM: Für Röstaromen Pfanne/Backofen; alternativ TM6 Anbratfunktion nutzen (5 Min.)).|Kartoffeln weich kochen (im TM: 10–20 Min./98 °C/Linkslauf/Stufe 1 garen).|Milch/Butter zugeben und stampfen (im TM: je nach Schritt 10 Sek./Stufe 3 mischen oder 5–10 Min./98 °C/Linkslauf/Stufe 1 garen).|würzen. (im TM: je nach Schritt 10 Sek./Stufe 3 mischen oder 5–10 Min./98 °C/Linkslauf/Stufe 1 garen).|Für die Soße Bratensatz mit Fond ablöschen (im TM: Für Röstaromen Pfanne/Backofen; alternativ TM6 Anbratfunktion nutzen (5 Min.)).|mit Mehlschwitze binden (im TM: je nach Schritt 10 Sek./Stufe 3 mischen oder 5–10 Min./98 °C/Linkslauf/Stufe 1 garen).|abschmecken. (im TM: je nach Schritt 10 Sek./Stufe 3 mischen oder 5–10 Min./98 °C/Linkslauf/Stufe 1 garen).","klassiker,familienessen"
Nudelpilzpfanne,"Schnelle Pasta-Pfanne mit Pilzen und Kräutern. TM-Hinweis: Pilze 4 Sek./Stufe 4, Sauce 8–10 Min./100°C; Nudeln separat.",4 Personen,PT25M,400 g kurze Pasta|300 g Pilze|1 Zwiebel|2 Knoblauchzehen|200 ml Sahne|100 ml Gemüsebrühe|2 EL Öl|Petersilie|Salz|Pfeffer,"Pasta in Salzwasser kochen. (im TM: 10–20 Min./98 °C/Linkslauf/Stufe 1 garen).|Zwiebel/Knoblauch anschwitzen (im TM: Zwiebel/Knoblauch 5 Sek./Stufe 5 zerkleinern, mit Spatel nach unten schieben; mit 1 EL Öl 3–5 Min./120 °C/Linkslauf/Stufe 1 dünsten (Messbecher entfernt)).|Pilze zugeben und braten. (im TM: Für Röstaromen Pfanne/Backofen; alternativ TM6 Anbratfunktion nutzen (5 Min.)).|Sahne und Brühe angießen (im TM: je nach Schritt 10 Sek./Stufe 3 mischen oder 5–10 Min./98 °C/Linkslauf/Stufe 1 garen).|5 Minuten einkochen (im TM: 10–20 Min./98 °C/Linkslauf/Stufe 1 garen).|würzen. (im TM: je nach Schritt 10 Sek./Stufe 3 mischen oder 5–10 Min./98 °C/Linkslauf/Stufe 1 garen).|Pasta unterheben (im TM: je nach Schritt 10 Sek./Stufe 3 mischen oder 5–10 Min./98 °C/Linkslauf/Stufe 1 garen).|mit Petersilie servieren. (im TM: je nach Schritt 10 Sek./Stufe 3 mischen oder 5–10 Min./98 °C/Linkslauf/Stufe 1 garen).","pasta,vegetarisch"
Rinderbraten mit Rotkohl und Knödel,Sonntagsklassiker. TM-Hinweis: Rotkohl im Mixtopf garen; Knödel separat; Bratensoße im Mixtopf ziehen.,4 Personen,PT3H0M,1|2 kg Rinderbraten|2 Zwiebeln|2 Möhren|1 Stück Sellerie|2 EL Tomatenmark|500 ml Rinderfond|200 ml Rotwein (optional)|2 EL Öl|Salz|Pfeffer|Lorbeer|Rotkohl (Fertig oder 1 Kopf + Apfel)|Kartoffel|oder Semmelknödel (Fertig oder Teig),"Braten salzen/pfeffern (im TM: Für Röstaromen Pfanne/Backofen; alternativ TM6 Anbratfunktion nutzen (5 Min.)).|in Öl scharf anbraten (im TM: mit 1 EL Öl 3–5 Min./120 °C/Linkslauf/Stufe 1 dünsten (Messbecher entfernt); Für Röstaromen Pfanne/Backofen; alternativ TM6 Anbratfunktion nutzen (5 Min.)).|herausnehmen. (im TM: je nach Schritt 10 Sek./Stufe 3 mischen oder 5–10 Min./98 °C/Linkslauf/Stufe 1 garen).|Zwiebeln (im TM: Zwiebel/Knoblauch 5 Sek./Stufe 5 zerkleinern, mit Spatel nach unten schieben).|Möhren (im TM: je nach Schritt 10 Sek./Stufe 3 mischen oder 5–10 Min./98 °C/Linkslauf/Stufe 1 garen).|Sellerie anrösten (im TM: mit 1 EL Öl 3–5 Min./120 °C/Linkslauf/Stufe 1 dünsten (Messbecher entfernt)).|Tomatenmark zugeben (im TM: je nach Schritt 10 Sek./Stufe 3 mischen oder 5–10 Min./98 °C/Linkslauf/Stufe 1 garen).|mit Fond/Rotwein ablöschen. (im TM: je nach Schritt 10 Sek./Stufe 3 mischen oder 5–10 Min./98 °C/Linkslauf/Stufe 1 garen).|Braten zurück (im TM: Für Röstaromen Pfanne/Backofen; alternativ TM6 Anbratfunktion nutzen (5 Min.)).|zugedeckt 2–2 (im TM: je nach Schritt 10 Sek./Stufe 3 mischen oder 5–10 Min./98 °C/Linkslauf/Stufe 1 garen).|5 h schmoren. (im TM: je nach Schritt 10 Sek./Stufe 3 mischen oder 5–10 Min./98 °C/Linkslauf/Stufe 1 garen).|Rotkohl separat garen (im TM: 10–20 Min./98 °C/Linkslauf/Stufe 1 garen).|Knödel kochen. (im TM: 10–20 Min./98 °C/Linkslauf/Stufe 1 garen).|Bratensoße passieren und abschmecken (im TM: Für Röstaromen Pfanne/Backofen; alternativ TM6 Anbratfunktion nutzen (5 Min.)).|alles servieren. (im TM: je nach Schritt 10 Sek./Stufe 3 mischen oder 5–10 Min./98 °C/Linkslauf/Stufe 1 garen).","festlich,klassiker"
Pilmeni-Pierogi-Rindfleisch-Pfanne,"Pfanne mit russischen/osteuropäischen Teigtaschen (Pilmeni/Pierogi) und Rindfleisch-Zwiebel-Mix. TM-Hinweis: Zwiebeln 5 Sek./Stufe 5, Pfanne zum Braten.",4 Personen,PT25M,600 g Pelmeni oder Pierogi (TK)|300 g Rindfleischstreifen|2 Zwiebeln|2 EL Butter oder Öl|200 g Schmand|Salz|Pfeffer|Dill,"Pelmeni/Pierogi nach Packung garen. (im TM: 10–20 Min./98 °C/Linkslauf/Stufe 1 garen).|Zwiebeln in Butter/Öl braten (im TM: Zwiebel/Knoblauch 5 Sek./Stufe 5 zerkleinern, mit Spatel nach unten schieben; Für Röstaromen Pfanne/Backofen; alternativ TM6 Anbratfunktion nutzen (5 Min.)).|Rindfleisch zugeben (im TM: je nach Schritt 10 Sek./Stufe 3 mischen oder 5–10 Min./98 °C/Linkslauf/Stufe 1 garen).|kurz scharf anbraten. (im TM: mit 1 EL Öl 3–5 Min./120 °C/Linkslauf/Stufe 1 dünsten (Messbecher entfernt); Für Röstaromen Pfanne/Backofen; alternativ TM6 Anbratfunktion nutzen (5 Min.)).|Pelmeni/Pierogi untermischen (im TM: je nach Schritt 10 Sek./Stufe 3 mischen oder 5–10 Min./98 °C/Linkslauf/Stufe 1 garen).|mit Schmand (im TM: je nach Schritt 10 Sek./Stufe 3 mischen oder 5–10 Min./98 °C/Linkslauf/Stufe 1 garen).|Salz (im TM: je nach Schritt 10 Sek./Stufe 3 mischen oder 5–10 Min./98 °C/Linkslauf/Stufe 1 garen).|Pfeffer und Dill abschmecken. (im TM: je nach Schritt 10 Sek./Stufe 3 mischen oder 5–10 Min./98 °C/Linkslauf/Stufe 1 garen).","pfannengericht,komfort"
Knödel mit Schwammerlsoße,Semmelknödel mit cremiger Pilzrahmsoße. TM-Hinweis: Soße im Mixtopf; Knödel im Varoma dämpfen.,4 Personen,PT30M,8 Semmelknödel (frisch oder Fertigprodukt)|400 g Pilze gemischt|1 Zwiebel|200 ml Sahne|200 ml Gemüsebrühe|2 EL Butter|Salz|Pfeffer|Petersilie,"Knödel nach Anleitung zubereiten. (im TM: je nach Schritt 10 Sek./Stufe 3 mischen oder 5–10 Min./98 °C/Linkslauf/Stufe 1 garen).|Zwiebel anschwitzen (im TM: Zwiebel/Knoblauch 5 Sek./Stufe 5 zerkleinern, mit Spatel nach unten schieben; mit 1 EL Öl 3–5 Min./120 °C/Linkslauf/Stufe 1 dünsten (Messbecher entfernt)).|Pilze zugeben und braten. (im TM: Für Röstaromen Pfanne/Backofen; alternativ TM6 Anbratfunktion nutzen (5 Min.)).|Mit Brühe und Sahne aufgießen (im TM: je nach Schritt 10 Sek./Stufe 3 mischen oder 5–10 Min./98 °C/Linkslauf/Stufe 1 garen).|5–8 Minuten köcheln (im TM: 10–20 Min./98 °C/Linkslauf/Stufe 1 garen).|würzen. (im TM: je nach Schritt 10 Sek./Stufe 3 mischen oder 5–10 Min./98 °C/Linkslauf/Stufe 1 garen).|Mit Petersilie bestreuen und zu Knödeln servieren. (im TM: je nach Schritt 10 Sek./Stufe 3 mischen oder 5–10 Min./98 °C/Linkslauf/Stufe 1 garen).","vegetarisch,soße"
Selbstgemachte Schnitzel,"Paniertes Schweine- oder Kalbsschnitzel, goldgelb ausgebacken. TM-Hinweis: Panade-Zutaten im Mixtopf zerkleinern/mischen.",4 Personen,PT25M,4 Schweine|oder Kalbsschnitzel (je 150–180 g)|Salz|Pfeffer|Mehl|2 Eier|Semmelbrösel|Butterschmalz zum Ausbacken|Zitronenspalten,Schnitzel flach klopfen (im TM: je nach Schritt 10 Sek./Stufe 3 mischen oder 5–10 Min./98 °C/Linkslauf/Stufe 1 garen).|salzen (im TM: je nach Schritt 10 Sek./Stufe 3 mischen oder 5–10 Min./98 °C/Linkslauf/Stufe 1 garen).|pfeffern. (im TM: je nach Schritt 10 Sek./Stufe 3 mischen oder 5–10 Min./98 °C/Linkslauf/Stufe 1 garen).|In Mehl wenden (im TM: je nach Schritt 10 Sek./Stufe 3 mischen oder 5–10 Min./98 °C/Linkslauf/Stufe 1 garen).|durch verquirlte Eier ziehen und in Semmelbröseln wenden. (im TM: je nach Schritt 10 Sek./Stufe 3 mischen oder 5–10 Min./98 °C/Linkslauf/Stufe 1 garen).|In heißem Butterschmalz schwimmend goldbraun ausbacken. (im TM: Hinweis: Backofen extern nutzen; TM für Saucen/Beilagen verwenden).|Mit Zitrone servieren. (im TM: je nach Schritt 10 Sek./Stufe 3 mischen oder 5–10 Min./98 °C/Linkslauf/Stufe 1 garen).,"klassiker,hauptgericht"
Gefüllte Zucchini,Mit Hackreis-Füllung und Käse überbacken. TM-Hinweis: Füllung im Mixtopf zerkleinern/mischen.,4 Personen,PT45M,4 kleine Zucchini|300 g Rinderhack|1 Beutel Reis (oder 120 g Rohreis)|1 Zwiebel|1 Knoblauchzehe|1 Dose Tomaten (400 g)|100 g geriebener Käse|2 EL Öl|Salz|Pfeffer|Oregano,"Zucchini halbieren (im TM: je nach Schritt 10 Sek./Stufe 3 mischen oder 5–10 Min./98 °C/Linkslauf/Stufe 1 garen).|aushöhlen. (im TM: je nach Schritt 10 Sek./Stufe 3 mischen oder 5–10 Min./98 °C/Linkslauf/Stufe 1 garen).|Reis garen. (im TM: 10–20 Min./98 °C/Linkslauf/Stufe 1 garen).|Zwiebel/Knoblauch anschwitzen (im TM: Zwiebel/Knoblauch 5 Sek./Stufe 5 zerkleinern, mit Spatel nach unten schieben; mit 1 EL Öl 3–5 Min./120 °C/Linkslauf/Stufe 1 dünsten (Messbecher entfernt)).|Hack anbraten (im TM: mit 1 EL Öl 3–5 Min./120 °C/Linkslauf/Stufe 1 dünsten (Messbecher entfernt); Für Röstaromen Pfanne/Backofen; alternativ TM6 Anbratfunktion nutzen (5 Min.)).|Tomaten und Gewürze zugeben (im TM: je nach Schritt 10 Sek./Stufe 3 mischen oder 5–10 Min./98 °C/Linkslauf/Stufe 1 garen).|Reis untermischen. (im TM: je nach Schritt 10 Sek./Stufe 3 mischen oder 5–10 Min./98 °C/Linkslauf/Stufe 1 garen).|Zucchini füllen (im TM: je nach Schritt 10 Sek./Stufe 3 mischen oder 5–10 Min./98 °C/Linkslauf/Stufe 1 garen).|mit Käse bestreuen und bei 180°C 20–25 Minuten backen. (im TM: Hinweis: Backofen extern nutzen; TM für Saucen/Beilagen verwenden).","ofen,gemaeuse"
Moussaka,"Griechischer Auflauf mit Auberginen, Hack und Béchamel. TM-Hinweis: Bolo & Béchamel im Mixtopf, Auberginen im Ofen vorbacken.",4 Personen,PT1H15M,2 Auberginen|500 g Hack (Rind/Lamm)|1 Zwiebel|2 Knoblauchzehen|1 Dose Tomaten (400 g)|2 EL Tomatenmark|Zimt/Allspice (Prise)|Olivenöl|Salz|Pfeffer|Béchamel: 60 g Butter|60 g Mehl|600 ml Milch|Muskat|Käse zum Überbacken,"Auberginen in Scheiben schneiden (im TM: Zwiebel/Knoblauch 5 Sek./Stufe 5 zerkleinern, mit Spatel nach unten schieben).|salzen (im TM: je nach Schritt 10 Sek./Stufe 3 mischen oder 5–10 Min./98 °C/Linkslauf/Stufe 1 garen).|20 Min ziehen lassen (im TM: je nach Schritt 10 Sek./Stufe 3 mischen oder 5–10 Min./98 °C/Linkslauf/Stufe 1 garen).|trocken tupfen und im Ofen vorbacken. (im TM: Hinweis: Backofen extern nutzen; TM für Saucen/Beilagen verwenden).|Hack mit Zwiebel/Knoblauch krümelig braten (im TM: Zwiebel/Knoblauch 5 Sek./Stufe 5 zerkleinern, mit Spatel nach unten schieben; Für Röstaromen Pfanne/Backofen; alternativ TM6 Anbratfunktion nutzen (5 Min.)).|Tomatenmark rösten (im TM: mit 1 EL Öl 3–5 Min./120 °C/Linkslauf/Stufe 1 dünsten (Messbecher entfernt)).|Tomaten und Gewürze zugeben (im TM: je nach Schritt 10 Sek./Stufe 3 mischen oder 5–10 Min./98 °C/Linkslauf/Stufe 1 garen).|köcheln. (im TM: 10–20 Min./98 °C/Linkslauf/Stufe 1 garen).|Béchamel kochen. (im TM: 10–20 Min./98 °C/Linkslauf/Stufe 1 garen).|Schichten: Auberginen (im TM: je nach Schritt 10 Sek./Stufe 3 mischen oder 5–10 Min./98 °C/Linkslauf/Stufe 1 garen).|Hack (im TM: je nach Schritt 10 Sek./Stufe 3 mischen oder 5–10 Min./98 °C/Linkslauf/Stufe 1 garen).|Béchamel (im TM: je nach Schritt 10 Sek./Stufe 3 mischen oder 5–10 Min./98 °C/Linkslauf/Stufe 1 garen).|bei 180–200°C ca. 35 Minuten backen. (im TM: Hinweis: Backofen extern nutzen; TM für Saucen/Beilagen verwenden).","auflauf,griechisch"
Kreative Burger,"Selbstgemachte Burger-Patties mit variablen Toppings (Cheddar, Bacon, Avocado, etc.). TM-Hinweis: Pattie-Masse kurz mischen; Saucen im Mixtopf.",4 Personen,PT25M,"600 g Rinderhack|4 Burgerbrötchen|Salz|Pfeffer|4 Scheiben Käse (z. B. Cheddar)|Toppings nach Wahl (Tomate, Salat, Gurke, Zwiebel, Bacon, Avocado)|Saucen nach Wahl",Hack salzen/pfeffern (im TM: je nach Schritt 10 Sek./Stufe 3 mischen oder 5–10 Min./98 °C/Linkslauf/Stufe 1 garen).|4 Patties formen. (im TM: je nach Schritt 10 Sek./Stufe 3 mischen oder 5–10 Min./98 °C/Linkslauf/Stufe 1 garen).|Patties in Pfanne/Grill braten (im TM: Für Röstaromen Pfanne/Backofen; alternativ TM6 Anbratfunktion nutzen (5 Min.)).|Käse zum Schmelzen auflegen. (im TM: je nach Schritt 10 Sek./Stufe 3 mischen oder 5–10 Min./98 °C/Linkslauf/Stufe 1 garen).|Brötchen kurz rösten (im TM: mit 1 EL Öl 3–5 Min./120 °C/Linkslauf/Stufe 1 dünsten (Messbecher entfernt)).|mit Toppings und Saucen nach Wunsch belegen. (im TM: je nach Schritt 10 Sek./Stufe 3 mischen oder 5–10 Min./98 °C/Linkslauf/Stufe 1 garen).,"fingerfood,grill"
Bruschetta,Geröstetes Brot mit Tomaten-Knoblauch-Belag. TM-Hinweis: Tomatenwürfel & Marinade 3–4 Sek./Stufe 4 mischen.,4 Personen,PT15M,1 Baguette oder Ciabatta|5 Tomaten|2 Knoblauchzehen|2 EL Olivenöl|Basilikum|Salz|Pfeffer,"Brot in Scheiben schneiden (im TM: Zwiebel/Knoblauch 5 Sek./Stufe 5 zerkleinern, mit Spatel nach unten schieben).|im Ofen rösten. (im TM: mit 1 EL Öl 3–5 Min./120 °C/Linkslauf/Stufe 1 dünsten (Messbecher entfernt); Hinweis: Backofen extern nutzen; TM für Saucen/Beilagen verwenden).|Tomaten würfeln (im TM: Zwiebel/Knoblauch 5 Sek./Stufe 5 zerkleinern, mit Spatel nach unten schieben).|mit Knoblauch (im TM: Zwiebel/Knoblauch 5 Sek./Stufe 5 zerkleinern, mit Spatel nach unten schieben).|Öl (im TM: je nach Schritt 10 Sek./Stufe 3 mischen oder 5–10 Min./98 °C/Linkslauf/Stufe 1 garen).|Basilikum (im TM: je nach Schritt 10 Sek./Stufe 3 mischen oder 5–10 Min./98 °C/Linkslauf/Stufe 1 garen).|Salz und Pfeffer mischen. (im TM: je nach Schritt 10 Sek./Stufe 3 mischen oder 5–10 Min./98 °C/Linkslauf/Stufe 1 garen).|Auf das warme Brot geben und sofort servieren. (im TM: je nach Schritt 10 Sek./Stufe 3 mischen oder 5–10 Min./98 °C/Linkslauf/Stufe 1 garen).","vorspeise,vegetarisch"
Selbstgemachte Pizza,Einfacher Pizzateig mit Tomatensauce und Wunschbelag. TM-Hinweis: Teig 2 Min./Knetstufe; Sauce 5 Sek./Stufe 5.,4 Personen,PT1H30M,Teig: 500 g Mehl|300 ml Wasser|1 Päckchen Trockenhefe|1 TL Salz|1 EL Olivenöl|Sauce: 1 Dose Tomaten (400 g)|1 Knoblauchzehe|Salz|Oregano|Belag nach Wahl|Käse|gerieben,"Teig kneten und 60 Minuten gehen lassen. (im TM: 30 Sek./Stufe 4 mischen, dann 2 Min./Knetstufe).|Sauce aus Tomaten (im TM: je nach Schritt 10 Sek./Stufe 3 mischen oder 5–10 Min./98 °C/Linkslauf/Stufe 1 garen).|Knoblauch (im TM: Zwiebel/Knoblauch 5 Sek./Stufe 5 zerkleinern, mit Spatel nach unten schieben).|Salz (im TM: je nach Schritt 10 Sek./Stufe 3 mischen oder 5–10 Min./98 °C/Linkslauf/Stufe 1 garen).|Oregano rühren. (im TM: je nach Schritt 10 Sek./Stufe 3 mischen oder 5–10 Min./98 °C/Linkslauf/Stufe 1 garen).|Teig ausrollen (im TM: 30 Sek./Stufe 4 mischen, dann 2 Min./Knetstufe).|belegen (im TM: je nach Schritt 10 Sek./Stufe 3 mischen oder 5–10 Min./98 °C/Linkslauf/Stufe 1 garen).|bei 250°C (oder Maximum) 10–12 Minuten backen. (im TM: Hinweis: Backofen extern nutzen; TM für Saucen/Beilagen verwenden).","pizza,familie"
